{
  "schema_version": 1,
  "id": "generic-model-alias-registry-fixture",
  "capability_id": "generic.ai.model.registry",
  "provider_free": true,
  "live_network": false,
  "aliases": [
    {
      "alias": "default",
      "target": "analyst",
      "kind": "alias"
    },
    {
      "alias": "analyst",
      "target": "fixture_analyst",
      "kind": "alias"
    },
    {
      "alias": "reviewer",
      "target": "fixture_reviewer",
      "kind": "alias"
    },
    {
      "alias": "fixture_analyst",
      "kind": "descriptor",
      "descriptor_ref": "model_registry:descriptor:fixture_analyst:v1"
    },
    {
      "alias": "fixture_reviewer",
      "kind": "descriptor",
      "descriptor_ref": "model_registry:descriptor:fixture_reviewer:v1"
    }
  ],
  "resolution_examples": [
    {
      "input_alias": "default",
      "path": [
        "default",
        "analyst",
        "fixture_analyst"
      ],
      "descriptor_ref": "model_registry:descriptor:fixture_analyst:v1"
    },
    {
      "input_alias": "reviewer",
      "path": [
        "reviewer",
        "fixture_reviewer"
      ],
      "descriptor_ref": "model_registry:descriptor:fixture_reviewer:v1"
    }
  ]
}

